{
  "schema_version": "1.0.0",
  "last_updated": "2025-10-31T18:40:00+05:30",
  "project_info": {
    "name": "AegisIDE Constitutional Governance Framework",
    "workspace_path": "/mnt/windows_d/Gauravs-Files-and-Folders/Projects/Portfolio/AegisIDE",
    "ide_type": "Cascade"
  },
  "events": [
    {
      "event_id": "evt_001",
      "timestamp": "2025-10-31T18:32:00+05:30",
      "event_type": "task_completion",
      "context": {
        "task_id": "F1.3",
        "workflow": "constitutional_governance",
        "phase": "implementation",
        "session_state": {
          "active_tasks": 1,
          "consensus_threshold": 0.95,
          "governance_mode": "adaptive"
        },
        "preconditions": {
          "dependencies_met": true,
          "research_available": true,
          "schema_ready": true
        },
        "outcomes": {
          "files_created": 4,
          "schemas_updated": 1,
          "compliance_score": 1.0
        }
      },
      "embedding_id": "emb_evt_001_abc123",
      "metadata": {
        "duration_minutes": 45,
        "complexity_score": 0.7,
        "success_indicators": ["c3ai_compliance", "ab_testing_framework", "evaluation_metrics"],
        "learning_points": ["graph_based_principles", "positive_framing", "statistical_validation"]
      }
    },
    {
      "event_id": "evt_002", 
      "timestamp": "2025-10-31T18:32:00+05:30",
      "event_type": "task_completion",
      "context": {
        "task_id": "F1.4",
        "workflow": "mona_integration",
        "phase": "security_enhancement",
        "session_state": {
          "anomaly_detection_active": true,
          "obfuscation_monitoring": true,
          "reward_system_protected": true
        },
        "preconditions": {
          "mona_research_integrated": true,
          "openai_o3_compliance": true,
          "trajectory_analysis_ready": true
        },
        "outcomes": {
          "mona_config_created": true,
          "obfuscation_monitor_deployed": true,
          "reward_hacking_patterns_identified": 15,
          "prevention_rules_established": 8
        }
      },
      "embedding_id": "emb_evt_002_def456",
      "metadata": {
        "duration_minutes": 38,
        "complexity_score": 0.8,
        "success_indicators": ["mona_compliance", "anomaly_detection", "obfuscation_monitoring"],
        "learning_points": ["trajectory_analysis", "reward_sequence_patterns", "transparency_tracking"]
      }
    },
    {
      "event_id": "evt_003",
      "timestamp": "2025-10-31T18:39:00+05:30", 
      "event_type": "task_completion",
      "context": {
        "task_id": "F2.1",
        "workflow": "dynamic_consensus",
        "phase": "governance_enhancement",
        "session_state": {
          "consensus_framework_active": true,
          "risk_based_thresholds": true,
          "multi_agent_voting": true
        },
        "preconditions": {
          "governance_as_a_service_research": true,
          "constitutional_bodies_ready": true,
          "voting_protocol_designed": true
        },
        "outcomes": {
          "consensus_thresholds_implemented": 4,
          "risk_levels_defined": 4,
          "voting_agents_configured": 4,
          "external_auditors_deployed": 3
        }
      },
      "embedding_id": "emb_evt_003_ghi789",
      "metadata": {
        "duration_minutes": 42,
        "complexity_score": 0.75,
        "success_indicators": ["dynamic_consensus", "risk_based_governance", "multi_agent_system"],
        "learning_points": ["adaptive_thresholds", "branch_weighted_voting", "audit_configuration"]
      }
    }
  ],
  "embedding_metadata": {
    "model": "all-MiniLM-L6-v2",
    "dimension": 384,
    "index_type": "usearch",
    "similarity_metric": "cosine",
    "last_index_update": "2025-10-31T18:40:00+05:30",
    "total_embeddings": 3,
    "index_size_mb": 0.2,
    "search_performance": {
      "average_query_time_ms": 12,
      "index_build_time_ms": 45,
      "memory_usage_mb": 8
    }
  },
  "event_statistics": {
    "total_events": 3,
    "event_types": {
      "task_completion": 3,
      "error_occurred": 0,
      "user_interaction": 0,
      "mcp_call": 0,
      "constitutional_decision": 0,
      "pattern_discovery": 0,
      "learning_event": 0
    },
    "temporal_distribution": {
      "today": 3,
      "this_week": 3,
      "this_month": 3
    },
    "complexity_metrics": {
      "average_complexity": 0.75,
      "max_complexity": 0.8,
      "min_complexity": 0.7
    }
  }
}
